{
  "$id": "https://posthog-impact.local/schemas/commit_parents.schema.json",
  "$schema": "https://json-schema.org/draft/2020-12/schema",
  "additionalProperties": false,
  "properties": {
    "commit_id": {
      "arrow_type": "string",
      "type": [
        "string",
        "null"
      ]
    },
    "commit_sha": {
      "arrow_type": "string",
      "type": [
        "string",
        "null"
      ]
    },
    "parent_commit_id": {
      "arrow_type": "string",
      "type": [
        "string",
        "null"
      ]
    },
    "parent_position": {
      "arrow_type": "int64",
      "type": [
        "integer",
        "null"
      ]
    },
    "parent_sha": {
      "arrow_type": "string",
      "type": [
        "string",
        "null"
      ]
    }
  },
  "title": "commit_parents",
  "type": "object",
  "x-pipeline-version": "1.0.0",
  "x-schema-version": "1.0.0"
}
