[
  {
    "commit_id": "github.com/PostHog/posthog#commit/00036d38ae536175d63455c0d0055affe43250cc",
    "commit_sha": "00036d38ae536175d63455c0d0055affe43250cc",
    "parent_commit_id": "github.com/PostHog/posthog#commit/666ed3c5938a092a777220dad3fbdddbb85f4601",
    "parent_position": 0,
    "parent_sha": "666ed3c5938a092a777220dad3fbdddbb85f4601"
  },
  {
    "commit_id": "github.com/PostHog/posthog#commit/0003aa972a2cfcd8e47c3bb6f47c04eb6209c2b8",
    "commit_sha": "0003aa972a2cfcd8e47c3bb6f47c04eb6209c2b8",
    "parent_commit_id": "github.com/PostHog/posthog#commit/e27e37071c0cc9e0aee6ba8dc809f6960963a157",
    "parent_position": 0,
    "parent_sha": "e27e37071c0cc9e0aee6ba8dc809f6960963a157"
  },
  {
    "commit_id": "github.com/PostHog/posthog#commit/00040714f156b0a283ec79590e19e94ff9c6589b",
    "commit_sha": "00040714f156b0a283ec79590e19e94ff9c6589b",
    "parent_commit_id": "github.com/PostHog/posthog#commit/70d90907525e25d28f91ffd4f86824a168b0db9c",
    "parent_position": 0,
    "parent_sha": "70d90907525e25d28f91ffd4f86824a168b0db9c"
  },
  {
    "commit_id": "github.com/PostHog/posthog#commit/00069ca66a70af631a6008c3eb7fa4eae1d5c87f",
    "commit_sha": "00069ca66a70af631a6008c3eb7fa4eae1d5c87f",
    "parent_commit_id": "github.com/PostHog/posthog#commit/b18bec2c2eb678624e7c1f69837786afc31ddb07",
    "parent_position": 0,
    "parent_sha": "b18bec2c2eb678624e7c1f69837786afc31ddb07"
  },
  {
    "commit_id": "github.com/PostHog/posthog#commit/000d0abdab8c45eb5456741c68a361562a5b8fc8",
    "commit_sha": "000d0abdab8c45eb5456741c68a361562a5b8fc8",
    "parent_commit_id": "github.com/PostHog/posthog#commit/ecfb40f1ff223c730c82513d7c354ac03922d358",
    "parent_position": 0,
    "parent_sha": "ecfb40f1ff223c730c82513d7c354ac03922d358"
  },
  {
    "commit_id": "github.com/PostHog/posthog#commit/000d92886f549a4124c7d461241c6db7d1efb006",
    "commit_sha": "000d92886f549a4124c7d461241c6db7d1efb006",
    "parent_commit_id": "github.com/PostHog/posthog#commit/38e2cbc2d3bff5f856111c540ac215dbaf1fb480",
    "parent_position": 0,
    "parent_sha": "38e2cbc2d3bff5f856111c540ac215dbaf1fb480"
  },
  {
    "commit_id": "github.com/PostHog/posthog#commit/0011a28f7a484a830ed03981c81a29830eeb7e51",
    "commit_sha": "0011a28f7a484a830ed03981c81a29830eeb7e51",
    "parent_commit_id": "github.com/PostHog/posthog#commit/b750b507d24bb8edb4a544f2d8efbd1c2500c926",
    "parent_position": 0,
    "parent_sha": "b750b507d24bb8edb4a544f2d8efbd1c2500c926"
  },
  {
    "commit_id": "github.com/PostHog/posthog#commit/00190e9730a80a958eb052c5803c42e0be1e3524",
    "commit_sha": "00190e9730a80a958eb052c5803c42e0be1e3524",
    "parent_commit_id": "github.com/PostHog/posthog#commit/8cca7b28357bd6667510c7a1d87817e363ecb503",
    "parent_position": 0,
    "parent_sha": "8cca7b28357bd6667510c7a1d87817e363ecb503"
  },
  {
    "commit_id": "github.com/PostHog/posthog#commit/001a5583ef12b9b56c0f15e84f066c40f7d225a2",
    "commit_sha": "001a5583ef12b9b56c0f15e84f066c40f7d225a2",
    "parent_commit_id": "github.com/PostHog/posthog#commit/9a7e56449ade5288fc8d8f8aec3e8167ac6af980",
    "parent_position": 0,
    "parent_sha": "9a7e56449ade5288fc8d8f8aec3e8167ac6af980"
  },
  {
    "commit_id": "github.com/PostHog/posthog#commit/0023f9c7b0e960ec5b6c4bfc7fce5a9daa877d8e",
    "commit_sha": "0023f9c7b0e960ec5b6c4bfc7fce5a9daa877d8e",
    "parent_commit_id": "github.com/PostHog/posthog#commit/8d7ac1be2c8277f36f22a13f9350e3b15e1bedb9",
    "parent_position": 0,
    "parent_sha": "8d7ac1be2c8277f36f22a13f9350e3b15e1bedb9"
  },
  {
    "commit_id": "github.com/PostHog/posthog#commit/00257c32d812c944d845c83bc98627d5459cf97b",
    "commit_sha": "00257c32d812c944d845c83bc98627d5459cf97b",
    "parent_commit_id": "github.com/PostHog/posthog#commit/9e4f7c47ae7ac5daafbc3816941087b1824e4e35",
    "parent_position": 0,
    "parent_sha": "9e4f7c47ae7ac5daafbc3816941087b1824e4e35"
  },
  {
    "commit_id": "github.com/PostHog/posthog#commit/0029527c02a2ed5af8e6d6fd913585b01d50e5c1",
    "commit_sha": "0029527c02a2ed5af8e6d6fd913585b01d50e5c1",
    "parent_commit_id": "github.com/PostHog/posthog#commit/74bfa5b393f529d5a7f80f79db06649a292bf2f4",
    "parent_position": 0,
    "parent_sha": "74bfa5b393f529d5a7f80f79db06649a292bf2f4"
  },
  {
    "commit_id": "github.com/PostHog/posthog#commit/002c8006cfd0794e2e81e765e0a90f92ad145581",
    "commit_sha": "002c8006cfd0794e2e81e765e0a90f92ad145581",
    "parent_commit_id": "github.com/PostHog/posthog#commit/dab8fb4c9c899376d0b9cd62f523e144cdc4dc19",
    "parent_position": 0,
    "parent_sha": "dab8fb4c9c899376d0b9cd62f523e144cdc4dc19"
  },
  {
    "commit_id": "github.com/PostHog/posthog#commit/0037887ac386553b113ae596b8364a6320b755a2",
    "commit_sha": "0037887ac386553b113ae596b8364a6320b755a2",
    "parent_commit_id": "github.com/PostHog/posthog#commit/7ac30dd32ed8ae3e67ab9377c6d709581479086c",
    "parent_position": 0,
    "parent_sha": "7ac30dd32ed8ae3e67ab9377c6d709581479086c"
  },
  {
    "commit_id": "github.com/PostHog/posthog#commit/0044f4e6b20d6b74e69fc5f23edd8e6285b6f1a5",
    "commit_sha": "0044f4e6b20d6b74e69fc5f23edd8e6285b6f1a5",
    "parent_commit_id": "github.com/PostHog/posthog#commit/ba481f3fbe9f72f3571819195ad5384d3cdeafb8",
    "parent_position": 0,
    "parent_sha": "ba481f3fbe9f72f3571819195ad5384d3cdeafb8"
  },
  {
    "commit_id": "github.com/PostHog/posthog#commit/00545aadc90bd6774edaa40f8ba074394bc58043",
    "commit_sha": "00545aadc90bd6774edaa40f8ba074394bc58043",
    "parent_commit_id": "github.com/PostHog/posthog#commit/5200d800c3434e5f02ff404b588fc82ca3613245",
    "parent_position": 0,
    "parent_sha": "5200d800c3434e5f02ff404b588fc82ca3613245"
  },
  {
    "commit_id": "github.com/PostHog/posthog#commit/00597e8579e186858717bde62bd73002829eed92",
    "commit_sha": "00597e8579e186858717bde62bd73002829eed92",
    "parent_commit_id": "github.com/PostHog/posthog#commit/591896af7648269bab89cc9f9d4ce40da0b4a9e6",
    "parent_position": 0,
    "parent_sha": "591896af7648269bab89cc9f9d4ce40da0b4a9e6"
  },
  {
    "commit_id": "github.com/PostHog/posthog#commit/0064087c479c416c6413e28e483f92618541f13c",
    "commit_sha": "0064087c479c416c6413e28e483f92618541f13c",
    "parent_commit_id": "github.com/PostHog/posthog#commit/3d6cea34e5314c69435ad3cfd806e4cd65d6675e",
    "parent_position": 0,
    "parent_sha": "3d6cea34e5314c69435ad3cfd806e4cd65d6675e"
  },
  {
    "commit_id": "github.com/PostHog/posthog#commit/006a8d5c9f1982fe752df891560a6cfc5d54c4d2",
    "commit_sha": "006a8d5c9f1982fe752df891560a6cfc5d54c4d2",
    "parent_commit_id": "github.com/PostHog/posthog#commit/5d215cc329012147b931eb061a14df8686858ef2",
    "parent_position": 0,
    "parent_sha": "5d215cc329012147b931eb061a14df8686858ef2"
  },
  {
    "commit_id": "github.com/PostHog/posthog#commit/006b9660ca77ce8b9c71b805ea7b3393e8fd2bc1",
    "commit_sha": "006b9660ca77ce8b9c71b805ea7b3393e8fd2bc1",
    "parent_commit_id": "github.com/PostHog/posthog#commit/64cd449ae0ea97be1e15a4ae9a0951b13fd99a65",
    "parent_position": 0,
    "parent_sha": "64cd449ae0ea97be1e15a4ae9a0951b13fd99a65"
  },
  {
    "commit_id": "github.com/PostHog/posthog#commit/006fe6411419b0a2a3e7161ae3f729f38b0a83c6",
    "commit_sha": "006fe6411419b0a2a3e7161ae3f729f38b0a83c6",
    "parent_commit_id": "github.com/PostHog/posthog#commit/629552af72a76fefd8c786de04856ed58edcd2f8",
    "parent_position": 0,
    "parent_sha": "629552af72a76fefd8c786de04856ed58edcd2f8"
  },
  {
    "commit_id": "github.com/PostHog/posthog#commit/00730892997b4e99780d33259845750b4c7b6c40",
    "commit_sha": "00730892997b4e99780d33259845750b4c7b6c40",
    "parent_commit_id": "github.com/PostHog/posthog#commit/1e22eb690a07033c5f4d50155bb2041bd497b1a8",
    "parent_position": 0,
    "parent_sha": "1e22eb690a07033c5f4d50155bb2041bd497b1a8"
  },
  {
    "commit_id": "github.com/PostHog/posthog#commit/0076aa9e49f87acf0685aa7e1013b9c24a1269f6",
    "commit_sha": "0076aa9e49f87acf0685aa7e1013b9c24a1269f6",
    "parent_commit_id": "github.com/PostHog/posthog#commit/4a41b528906c9f16e85a28e2b0f4248c8d70fc45",
    "parent_position": 0,
    "parent_sha": "4a41b528906c9f16e85a28e2b0f4248c8d70fc45"
  },
  {
    "commit_id": "github.com/PostHog/posthog#commit/0078a40f471d44a540732a8847fd8310fd9c2f70",
    "commit_sha": "0078a40f471d44a540732a8847fd8310fd9c2f70",
    "parent_commit_id": "github.com/PostHog/posthog#commit/bd7bc180d81e2cdccdac218ac83edea401231608",
    "parent_position": 0,
    "parent_sha": "bd7bc180d81e2cdccdac218ac83edea401231608"
  },
  {
    "commit_id": "github.com/PostHog/posthog#commit/00795df204008bf7df7b9dd347a654c3eb102bf1",
    "commit_sha": "00795df204008bf7df7b9dd347a654c3eb102bf1",
    "parent_commit_id": "github.com/PostHog/posthog#commit/9f0a880e68218e49e000386979349aa50c85e3a0",
    "parent_position": 0,
    "parent_sha": "9f0a880e68218e49e000386979349aa50c85e3a0"
  }
]
